{
  "$defs": {
    "artifactRef": {
      "additionalProperties": false,
      "properties": {
        "digest": {
          "pattern": "^sha256:[0-9a-f]{64}$",
          "type": "string"
        },
        "id": {
          "minLength": 1,
          "type": "string"
        }
      },
      "required": [
        "id",
        "digest"
      ],
      "type": "object"
    },
    "metadata": {
      "additionalProperties": false,
      "properties": {
        "fixture_only": {
          "type": "boolean"
        },
        "note": {
          "type": "string"
        }
      },
      "type": "object"
    }
  },
  "$id": "engineering-system/execution-binding/m0-v1",
  "$schema": "https://json-schema.org/draft/2020-12/schema",
  "additionalProperties": false,
  "properties": {
    "assignment_ref": {
      "$ref": "#/$defs/artifactRef"
    },
    "binding_id": {
      "type": "string"
    },
    "contract_set_ref": {
      "$ref": "#/$defs/artifactRef"
    },
    "disclosure_policy_ref": {
      "$ref": "#/$defs/artifactRef"
    },
    "eligibility_ref": {
      "$ref": "#/$defs/artifactRef"
    },
    "metadata": {
      "$ref": "#/$defs/metadata"
    },
    "patch_policy_ref": {
      "$ref": "#/$defs/artifactRef"
    },
    "plan_ref": {
      "$ref": "#/$defs/artifactRef"
    },
    "profile_ref": {
      "$ref": "#/$defs/artifactRef"
    },
    "requirement_ref": {
      "$ref": "#/$defs/artifactRef"
    },
    "schema": {
      "const": "engineering-system/execution-binding/m0-v1"
    },
    "semantic_digest": {
      "pattern": "^sha256:[0-9a-f]{64}$",
      "type": "string"
    }
  },
  "required": [
    "schema",
    "binding_id",
    "semantic_digest",
    "plan_ref",
    "requirement_ref",
    "assignment_ref",
    "profile_ref",
    "eligibility_ref",
    "disclosure_policy_ref",
    "patch_policy_ref",
    "contract_set_ref"
  ],
  "type": "object"
}
